text_id,text_content,text_content_en
161,"你获得了医生的健康建议，这些话语就像是对现代生活方式的一次温和的判决书。'多运动，少熬夜，规律饮食'——每一条都是对你当前生活的无声控诉。你点头称是，心里却在计算着什么时候能够真正做到。也许健康的生活方式本身就是一种奢侈品，需要时间、金钱和意志力的三重支撑。","You receive health advice from the doctor, these words like a gentle verdict on modern lifestyle. 'Exercise more, stay up less, eat regularly'—each point a silent accusation against your current life. You nod in agreement while mentally calculating when you could actually achieve this. Perhaps a healthy lifestyle itself is a luxury requiring the triple support of time, money, and willpower."
162,"你查询着各种健康信息，试图在信息的海洋中找到救赎的答案。每一篇文章都在告诉你不同的真理，每一个专家都有自己的理论。你开始怀疑，在这个信息爆炸的时代，我们是更接近真相了，还是离真相更远了？也许最好的健康建议就是：少看健康建议，多听身体的声音。","You search through various health information, trying to find salvation in the ocean of data. Every article tells you different truths, every expert has their own theory. You begin to wonder: in this era of information explosion, are we closer to truth or further from it? Perhaps the best health advice is: read less health advice, listen more to your body's voice."
163,"你预约了后续的检查，这个简单的行为背后隐藏着对未来的一种投资——或者说，是对恐惧的一种管理。每一次预约都是在和时间赛跑，和衰老谈判，和死亡讨价还价。你开始理解，现代医学的本质不是治愈，而是延缓——延缓那个我们都知道但不愿面对的终点。","You schedule follow-up examinations, this simple act hiding an investment in the future—or rather, a management of fear. Every appointment is racing against time, negotiating with aging, bargaining with death. You begin to understand that the essence of modern medicine isn't cure, but delay—delaying that endpoint we all know but refuse to face."
164,"你开始关注自己的身体状况，这种关注带着一种近乎神经质的精确性。每一个小症状都被放大，每一次不适都被解读。你意识到，当我们开始过度关注身体时，身体反而变成了一个陌生的敌人。也许真正的健康不是没有症状，而是能够与症状和平共处。","You begin paying attention to your physical condition, this attention carrying an almost neurotic precision. Every minor symptom gets magnified, every discomfort gets interpreted. You realize that when we start paying excessive attention to our bodies, the body becomes a strange enemy instead. Perhaps true health isn't the absence of symptoms, but the ability to coexist peacefully with them."
165,"你制定了详细的健康计划，这份计划就像是对生活的一次重新编程。每一项指标都要达标，每一个习惯都要养成，仿佛把人生当作了一个需要优化的项目。但你很快发现，最完美的计划往往败给最简单的惰性。也许真正的健康管理不是制定计划，而是学会原谅自己的不完美。","You formulate a detailed health plan, this plan like a reprogramming of life. Every indicator must meet standards, every habit must be formed, as if treating life as a project needing optimization. But you quickly discover that the most perfect plans often lose to the simplest inertia. Perhaps true health management isn't making plans, but learning to forgive your own imperfections."