text_id,text_content,text_content_en
61,"你凝视着这团被时间和绝望雕琢过的代码，就像考古学家面对着古文明的遗迹。每一行代码都在诉说着前任程序员的痛苦与挣扎，而你现在要做的，就是给这些数字化的骸骨重新注入生命。重构不是技术活动，而是一场与过去的和解——你要拆掉别人的梦想废墟，建造自己的梦想废墟。","You stare at this mass of code sculpted by time and despair, like an archaeologist facing relics of ancient civilization. Every line tells the story of a predecessor's pain and struggle, and what you must do now is breathe life back into these digital remains. Refactoring isn't a technical activity—it's reconciliation with the past. You're dismantling someone else's dream ruins to build your own dream ruins."
62,"你打开技术博客，阅读业界实践，就像一个溺水者阅读游泳手册。每篇文章都充满了成功的故事和光明的前景，但你知道这些都是幸存者偏差的产物。真实的行业就像海洋——表面风平浪静，但下面暗流涌动，到处都是沉船的残骸。你学习着别人的经验，但内心深处，你知道每个人最终都要独自面对自己的风暴。","You open tech blogs, reading industry practices like a drowning person reading a swimming manual. Every article is filled with success stories and bright prospects, but you know these are products of survivor bias. The real industry is like the ocean—calm on the surface, but with undercurrents below and shipwreck debris everywhere. You study others' experiences, but deep down, you know everyone must ultimately face their own storms alone."
63,"项目知识学习时间——你试图理解这个项目的业务逻辑，就像试图理解一个疯子的思维过程。每个需求都建立在前一个需求的废墟上，每个功能都是对前一个功能的否定。你感觉自己正在学习一门失传的语言，这门语言的语法规则每天都在变化，而且没有人记得为什么要这样设计。这就是企业知识的本质：一套精心构建的混乱系统。","Project knowledge learning time—you try to understand this project's business logic like trying to understand a madman's thought process. Every requirement is built on the ruins of the previous one, every feature a negation of the last. You feel like you're learning a lost language whose grammar rules change daily, and no one remembers why it was designed this way. This is the essence of corporate knowledge: a carefully constructed chaos system."
64,"与客户沟通的时刻到了。你整理着措辞，就像律师准备为一桩注定败诉的案件进行辩护。客户的每个需求都像是对现实的否定，每个问题都像是对逻辑的挑战。你学会了微笑着说'我们会考虑'，内心却在默默计算这会增加多少工作量。这是一场礼貌的战争，双方都在用文明的语言进行野蛮的较量。客户永远是对的，这是企业世界的第一定律——也是最大的谎言。","Time to communicate with clients. You organize your words like a lawyer preparing to defend a case destined to lose. Every client requirement is a denial of reality, every question a challenge to logic. You've learned to smile and say 'we'll consider it' while silently calculating how much workload this will add. This is a polite war where both sides use civilized language for savage competition. The customer is always right—this is the first law of the corporate world, and also its greatest lie."
65,"技术博客发布时间——你将自己的经验包装成智慧的珍珠，投向互联网的茫茫大海。每个字都经过精心雕琢，就像化妆师为尸体上妆，让失败看起来像成功，让困惑看起来像洞察。你知道这些文字会被其他迷茫的程序员阅读，他们会像你曾经一样，从中寻找救赎的线索。这是一个奇怪的循环：绝望的人向绝望的人传授希望。","Tech blog publishing time—you package your experiences into pearls of wisdom, casting them into the vast ocean of the internet. Every word is carefully crafted, like a mortician applying makeup to a corpse, making failure look like success, confusion like insight. You know these words will be read by other lost programmers who, like you once did, will search for clues of redemption. It's a strange cycle: desperate people teaching hope to desperate people."
66,"项目排期与任务跟踪——你打开甘特图，凝视着这些彩色的时间监狱。每个任务节点都像是人生的里程碑，但这些里程碑通向的不是成功，而是下一个里程碑。你开始理解时间管理的本质：不是管理时间，而是管理对时间流逝的焦虑。每个截止日期都是一次小型的末日预言，而你就是那个负责推迟末日的先知。","Project scheduling and task tracking—you open the Gantt chart, staring at these colorful time prisons. Every task node is like a life milestone, but these milestones don't lead to success—they lead to the next milestone. You begin to understand the essence of time management: it's not managing time, but managing anxiety about time's passage. Every deadline is a minor apocalyptic prophecy, and you're the prophet responsible for postponing doomsday."
67,"构思解决方案的时刻——你的大脑像一台过载的服务器，处理着无数个可能性。每个方案都有致命的缺陷，每个思路都通向新的困境。你开始意识到，所谓的'解决方案'其实是'把问题换个地方'。就像医生治疗头痛的方法是把痛苦转移到心脏，你的任务就是让问题在不同的地方开花结果。这就是工程师的宿命：永远在解决由解决方案产生的问题。","Solution brainstorming time—your brain works like an overloaded server, processing countless possibilities. Every solution has fatal flaws, every approach leads to new predicaments. You begin to realize that 'solutions' are actually 'relocating problems.' Like a doctor treating headaches by transferring pain to the heart, your job is to make problems bloom in different places. This is the engineer's fate: forever solving problems created by solutions."
68,"技术攻关的时刻到了——你面对着这个技术难题，就像堂吉诃德面对风车。这不仅仅是技术挑战，更是对个人意志的试炼。每一行代码都是对不可能的挑战，每一次调试都是对现实的拒绝。你知道这可能是徒劳的，但你也知道，在企业的世界里，英雄主义是唯一剩下的浪漫。失败是预料之中的，但过程中的痛苦却是真实的——这或许就是技术工作的全部意义。","Technical breakthrough time—you face this technical challenge like Don Quixote facing windmills. This isn't just a technical challenge, but a trial of personal will. Every line of code is a challenge to the impossible, every debug session a refusal of reality. You know this might be futile, but you also know that in the corporate world, heroism is the only romance left. Failure is expected, but the pain in the process is real—perhaps this is the entire meaning of technical work."
69,"邮件汇报工作进度——你打开邮箱，准备将今天的工作包装成华丽的进度报告。每个百分比都经过精心计算，让延期看起来像提前，让停滞看起来像进展。这是一门精妙的艺术：用数字编织谎言，用表格掩盖真相。你知道收件人也知道这些都是假的，但大家都在参与这场集体的自我欺骗。在企业的世界里，真相是奢侈品，而进度报告是必需品。","Email work progress reporting—you open your inbox, preparing to package today's work into a gorgeous progress report. Every percentage is carefully calculated to make delays look like advances, stagnation like progress. This is a sophisticated art: weaving lies with numbers, hiding truth with spreadsheets. You know the recipients know this is all fake, but everyone participates in this collective self-deception. In the corporate world, truth is a luxury, while progress reports are necessities."
70,"实现技术demo的时间——你要创造一个技术幻象，让不可能看起来触手可及。这不是工程，而是魔术表演，你是那个明知道魔术原理但依然要装作相信奇迹的观众。每行代码都在为一个注定要破灭的梦想服务，但你依然要让它看起来完美无缺。这就是demo的本质：用有限的时间创造无限的期望，然后在现实中慢慢偿还这些期望债务。","Time to implement the tech demo—you must create a technical illusion, making the impossible seem within reach. This isn't engineering, but magic performance, and you're the audience who knows the trick but must still pretend to believe in miracles. Every line of code serves a dream destined to shatter, but you must still make it appear flawless. This is the essence of demos: creating infinite expectations with finite time, then slowly paying back those expectation debts in reality."
71,"技术新闻阅读时间——你浏览着这些充满希望的标题，就像一个末日生存者阅读着旧世界的报纸。每篇文章都在描述着技术的美好未来，但你知道这些都是广告商的幻想。真正的技术新闻应该报道有多少程序员因为新框架而彻夜失眠，有多少项目因为追求新潮而夭折。但这些真相永远不会成为头条，因为绝望不如希望卖得好。","Tech news reading time—you browse these hopeful headlines like a doomsday survivor reading newspapers from the old world. Every article describes technology's bright future, but you know these are advertisers' fantasies. Real tech news should report how many programmers lose sleep over new frameworks, how many projects die pursuing trends. But these truths never make headlines, because despair doesn't sell as well as hope."
72,"偷偷投简历的时刻——你小心翼翼地更新着简历，就像一个间谍准备叛国文件。每个技能都被夸大，每项经历都被美化，你把自己包装成一个不存在的完美候选人。这是一场奇怪的游戏：你假装自己是理想员工，而雇主假装他们有理想工作。双方都在撒谎，但都假装相信对方说的是真话。这就是就业市场的本质：一个建立在相互欺骗基础上的信任体系。","Secret job application time—you carefully update your resume like a spy preparing treason documents. Every skill is exaggerated, every experience embellished, packaging yourself as a perfect candidate who doesn't exist. This is a strange game: you pretend to be the ideal employee while employers pretend they have ideal jobs. Both sides lie but pretend to believe the other's truth. This is the essence of the job market: a trust system built on mutual deception."
73,"外卖下单时间——你凝视着手机屏幕上琳琅满目的选择，就像哲学家思考存在的意义。每道菜都承诺着满足，但你知道真正的饥饿不在胃里，而在心里。你点击下单，参与了这个城市的物流奇迹：无数个陌生人为了让你获得20分钟的味觉满足而奔波劳碌。这就是现代文明的缩影：用别人的劳动填补自己的空虚。","Food delivery ordering time—you stare at the dazzling choices on your phone screen like a philosopher contemplating the meaning of existence. Every dish promises satisfaction, but you know real hunger isn't in your stomach—it's in your heart. You click order, participating in the city's logistics miracle: countless strangers bustling about so you can have 20 minutes of taste satisfaction. This is modern civilization in microcosm: filling your own emptiness with others' labor."
74,"咖啡续命时间——你点击下单按钮，购买这杯液体希望。咖啡因不能解决你的问题，但至少能让你清醒地意识到问题的存在。这杯咖啡承载着程序员的集体信仰：苦涩的液体能够转化为代码的灵感。你知道这是自我欺骗，但这种欺骗是如此必要，就像宗教对于绝望者的意义。每一口都是对疲惫的反抗，每一滴都是对现实的抗议。","Coffee life-support time—you click the order button, purchasing this cup of liquid hope. Caffeine can't solve your problems, but at least it lets you clearly perceive their existence. This coffee carries programmers' collective faith: bitter liquid can transform into code inspiration. You know this is self-deception, but such deception is so necessary, like religion's meaning to the desperate. Every sip is rebellion against fatigue, every drop a protest against reality."
75,"查看工作邮件时间——你打开收件箱，就像打开潘多拉的盒子。每封邮件都是新的麻烦，每个附件都是新的负担。你学会了从标题判断紧急程度，从发件人猜测政治立场。这些电子信息就像现代的信鸽，传递着企业帝国的各种焦虑。你快速扫视着这些数字化的压力源，心中默念着程序员的古老咒语：'这不是bug，这是feature'。","Work email checking time—you open your inbox like opening Pandora's box. Every email is new trouble, every attachment a new burden. You've learned to judge urgency from subject lines, guess political positions from senders. These electronic messages are like modern carrier pigeons, delivering various anxieties of the corporate empire. You quickly scan these digital stress sources, silently chanting the ancient programmer mantra: 'It's not a bug, it's a feature.'"
76,"散步思考时间——你离开工位，开始在办公楼里的短途朝圣。每一步都在为大脑充氧，每一次深呼吸都在为思维排毒。你从一个立方体走到另一个立方体，感受着这个巨大机器的脉搏。走廊里的每个人都在假装忙碌，就像你在假装思考一样。这种移动冥想让你暂时逃离代码的束缚，但你知道，无论走多远，你最终都要回到那个等待着你的屏幕前。","Walking and thinking time—you leave your workstation, beginning a short pilgrimage through the office building. Every step oxygenates your brain, every deep breath detoxifies your thoughts. You walk from one cubicle to another, feeling the pulse of this giant machine. Everyone in the hallway pretends to be busy, just as you pretend to think. This mobile meditation temporarily frees you from code's shackles, but you know that no matter how far you walk, you must eventually return to that screen waiting for you."
77,"偷听同事交流时间——你假装专注于工作，实际上在收集着办公室政治的情报。每个对话碎片都是权力结构的线索，每个叹息都是不满情绪的信号。你成了这个企业生态系统的窃听者，通过别人的抱怨来验证自己的痛苦。这种偷听让你感到既兴奋又羞愧——兴奋于发现自己不是唯一痛苦的人，羞愧于自己竟然需要别人的痛苦来获得安慰。","Eavesdropping on colleagues time—you pretend to focus on work while actually gathering office politics intelligence. Every conversation fragment is a clue to power structures, every sigh a signal of dissatisfaction. You've become an eavesdropper in this corporate ecosystem, validating your own pain through others' complaints. This eavesdropping makes you feel both excited and ashamed—excited to discover you're not the only one suffering, ashamed that you need others' pain for comfort."
78,"巡视工作环境时间——作为有一定级别的你，开始例行检查这个数字化的领地。你走过一排排工位，就像将军检阅部队，但这些士兵都在与看不见的敌人作战。每个显示器都显示着不同的战场，每个键盘都在演奏着加班的挽歌。你意识到自己正在管理一个充满了活死人的部门，而你就是这些活死人的首领。这种巡视让你感到权力，也让你感到空虚。","Work environment inspection time—with your certain level of authority, you begin routine inspection of this digital territory. You walk past rows of workstations like a general reviewing troops, but these soldiers fight invisible enemies. Every monitor displays different battlefields, every keyboard plays overtime dirges. You realize you're managing a department full of living dead, and you're their leader. This inspection makes you feel powerful, and also empty."
79,"寻找空会议室时间——你在楼层间游荡，寻找一个可以暂时逃避的避难所。每个会议室都像是一个小型的战场，留下了无数次会议的创伤痕迹。你推开一扇扇门，希望找到一个没有被企业政治污染的净土。但你渐渐意识到，在这个建筑里，没有真正的私人空间，就像在这个公司里，没有真正的个人思想。每个房间都在监视着你，每面墙都在记录着你的行为。","Finding empty meeting room time—you wander between floors, seeking a sanctuary where you can temporarily escape. Every meeting room is like a small battlefield, bearing trauma traces from countless meetings. You push open door after door, hoping to find uncontaminated ground unpolluted by corporate politics. But you gradually realize that in this building, there's no truly private space, just as in this company, there are no truly personal thoughts. Every room watches you, every wall records your behavior."
80,"上厕所时间——你走向这个现代文明中最后的避难所，这个连企业文化都无法完全侵蚀的私人空间。在这几平方米的密闭空间里，你可以暂时卸下职业面具，做回一个简单的生物学存在。你凝视着镜子中的自己，看到了一个被代码和会议折磨得憔悴的灵魂。这里是你一天中唯一可以诚实面对自己的地方，也是唯一可以真正独处的时刻。在这里，你不是程序员，不是员工，只是一个需要释放的人类。","Restroom time—you head toward this last sanctuary of modern civilization, this private space that even corporate culture cannot completely erode. In these few square meters of enclosed space, you can temporarily remove your professional mask and return to being a simple biological existence. You stare at yourself in the mirror, seeing a soul worn down by code and meetings. This is the only place in your day where you can honestly face yourself, the only moment of true solitude. Here, you're not a programmer, not an employee, just a human who needs release."