text_id,text_content,text_content_en
193,"发薪日到了，银行账户里的数字增加了，但你的心情却没有相应的提升。这些钱就像是对你时间和精力的一种补偿，但你知道，真正失去的东西是无法用金钱衡量的。你看着工资条上的各项扣除，每一项都在提醒你，你是这个庞大系统中的一个纳税单位。金钱的到来带来的不是自由，而是下一个月继续工作的义务。","Payday arrives, the numbers in your bank account increase, but your mood doesn't lift correspondingly. This money is like compensation for your time and energy, but you know what's truly lost cannot be measured in money. You look at the deductions on your pay slip, each one reminding you that you're a taxpaying unit in this vast system. Money's arrival brings not freedom, but the obligation to continue working next month."
194,"房租到期了，你按时支付了这笔巨额费用。这不仅仅是对居住空间的租赁，更像是对城市生活权利的购买。每个月的房租都在提醒你，在这个城市里，你只是一个临时的居住者，而不是真正的主人。你开始计算，要工作多少天才能支付这个月的房租，这种计算让你意识到时间是如何被货币化的。","Rent is due, and you pay this enormous sum on time. This isn't just renting living space, but more like purchasing the right to city life. Each month's rent reminds you that in this city, you're just a temporary resident, not a true owner. You begin calculating how many days you must work to pay this month's rent, this calculation making you realize how time becomes monetized."
195,"同事1主动承担了部分工作任务，这种合作让你感到一丝温暖。在这个竞争激烈的环境中，互助显得格外珍贵。你们就像两个在暴风雨中相互扶持的旅人，虽然知道这种合作可能只是暂时的，但至少在这一刻，你们不是孤军奋战。这种职场友谊建立在共同的疲惫和理解之上。","Colleague 1 proactively takes on part of the work tasks, this cooperation bringing you a trace of warmth. In this competitive environment, mutual aid seems especially precious. You're like two travelers supporting each other in a storm, knowing this cooperation might be temporary, but at least in this moment, you're not fighting alone. This workplace friendship is built on shared exhaustion and understanding."
196,"你将任务分派给同事1，这种权力的行使让你体验到管理的复杂性。你需要在效率和人情之间找到平衡，在权威和友谊之间寻找边界。每一次任务分配都是一种微妙的权力游戏，你开始理解为什么管理者总是显得疲惫——他们不仅要管理工作，更要管理人心。","You assign tasks to Colleague 1, this exercise of power letting you experience management's complexity. You need to find balance between efficiency and human feelings, seek boundaries between authority and friendship. Each task assignment is a subtle power game; you begin understanding why managers always seem exhausted—they must manage not just work, but human hearts."
197,"你慎重地将重要任务托付给同事1，这种信任建立在对彼此绝望程度的精确评估之上。你知道他会认真完成，不是因为责任感，而是因为在这个系统中，每个人都在拼命证明自己的价值。这种托付就像是在沙滩上建造城堡——你们都知道潮水会来，但还是要假装这很重要。","You carefully entrust important tasks to Colleague 1, this trust built on precise assessment of each other's level of despair. You know they'll complete it seriously, not from responsibility, but because in this system, everyone desperately tries to prove their worth. This entrustment is like building castles on the beach—you both know the tide will come, but still pretend it matters."
198,"同事2接手了你的部分工作，这种默契的配合让你感到一丝安慰。在这个每个人都在为自己奋斗的环境中，偶尔的互助显得格外珍贵。你们就像两个在暴风雨中相互取暖的旅人，虽然知道这只是暂时的，但至少此刻不那么孤独。这种职场友谊建立在共同的疲惫之上，比任何理想主义的情感都要真实。","Colleague 2 takes over part of your work, this tacit cooperation bringing you a trace of comfort. In this environment where everyone fights for themselves, occasional mutual aid seems especially precious. You're like two travelers warming each other in a storm, knowing it's only temporary, but at least not so lonely right now. This workplace friendship is built on shared exhaustion, more real than any idealistic emotion."
199,"你安排同事2处理一些任务，这种委派让你体验到了管理的微妙平衡。你需要在不显得专横的情况下行使权威，在不伤害关系的前提下推进工作。这就像是在钢丝上跳舞——一边要保持平衡，一边还要假装这很轻松。你开始理解为什么很多管理者看起来都很疲惫，因为他们每天都在进行这种精神上的杂技表演。","You arrange for Colleague 2 to handle some tasks, this delegation letting you experience management's delicate balance. You need to exercise authority without appearing tyrannical, advance work without damaging relationships. It's like dancing on a tightrope—maintaining balance while pretending it's effortless. You begin to understand why many managers look exhausted, because they perform this mental acrobatics daily."
200,"你将关键任务托付给同事2，这种信任的建立需要对人性的深刻理解。你知道在这个体系中，每个人都有自己的算盘，但有时候这些算盘会神奇地重合。这种托付不是基于友谊，而是基于对彼此利益的精确计算。你们就像两个在同一条船上的人，虽然各有心思，但都不希望船沉。","You entrust key tasks to Colleague 2, this trust requiring deep understanding of human nature. You know in this system, everyone has their own calculations, but sometimes these calculations magically align. This entrustment isn't based on friendship, but precise calculation of mutual interests. You're like two people on the same boat, each with their own thoughts, but neither wanting the boat to sink."
201,"同事3分担了你的工作负担，这种合作在竞争激烈的职场中显得弥足珍贵。你们之间的默契不是来自友谊，而是来自对现实的共同理解——在这个系统中，单打独斗只会让自己更快地被消耗殆尽。这种实用主义的合作关系，或许比任何浪漫化的团队精神都要可靠。","Colleague 3 shares your work burden, this cooperation precious in the competitive workplace. The tacit understanding between you doesn't come from friendship, but from shared understanding of reality—in this system, going it alone only leads to faster burnout. This pragmatic cooperation might be more reliable than any romanticized team spirit."
202,"你将任务分配给同事3，这种权力的运用让你思考管理的本质。每一次分配都是一种微妙的权力展示，你需要在效率和人际关系之间找到平衡。你开始理解，管理不仅仅是分配任务，更是在管理人们的期望、情绪和动机。这是一门复杂的艺术，需要在理性和感性之间不断切换。","You assign tasks to Colleague 3, this use of power making you think about management's essence. Each assignment is a subtle display of power; you need to find balance between efficiency and interpersonal relationships. You begin understanding that management isn't just assigning tasks, but managing people's expectations, emotions, and motivations. It's a complex art requiring constant switching between rationality and emotion."
203,"你谨慎地将重要工作托付给同事3，这种信任的建立是一个复杂的过程。在这个充满不确定性的环境中，信任变成了一种奢侈品。你们的合作不是基于感情，而是基于对彼此能力和动机的理性评估。这种冷静的信任关系，或许比热情的友谊更加持久和可靠。","You carefully entrust important work to Colleague 3, this trust-building being a complex process. In this uncertain environment, trust becomes a luxury. Your cooperation isn't based on emotion, but rational assessment of each other's abilities and motivations. This calm trust relationship might be more lasting and reliable than passionate friendship."
204,"晨会开始了，大家围坐在会议桌前，准备进行每日的信息同步。这是现代办公室的晨祷仪式——每个人都要汇报自己的工作状态，就像在向某个看不见的神灵忏悔。你看着同事们疲惫的面容，意识到这种仪式的真正目的不是沟通，而是确认每个人都还活着，都还在系统中运转。","The morning meeting begins, everyone sitting around the conference table, ready for daily information synchronization. This is the modern office's morning prayer ritual—everyone must report their work status, like confessing to some invisible deity. You look at colleagues' weary faces, realizing this ritual's true purpose isn't communication, but confirming everyone is still alive, still functioning in the system."
205,"每周技术评审会议如期举行，这是对过去一周工作成果的集体审判。每个人都要为自己的代码和决策进行辩护，就像在法庭上为自己的清白作证。你开始理解，这种评审不仅仅是技术交流，更是一种权力的展示和等级的确认。在这个过程中，知识变成了武器，经验变成了盔甲。","The weekly technical review meeting proceeds as scheduled, a collective judgment of the past week's work results. Everyone must defend their code and decisions, like testifying for their innocence in court. You begin understanding this review isn't just technical exchange, but a display of power and confirmation of hierarchy. In this process, knowledge becomes weapons, experience becomes armor."
206,"月度考核来了，这是对你这个月表现的量化评估。数字和指标试图捕捉你的价值，但你知道，真正重要的东西往往无法被测量。这种考核就像是用尺子测量诗歌的美感——工具是精确的，但对象是错误的。你开始思考，在这个数据驱动的时代，人的价值是否也被简化成了几个冰冷的数字？","Monthly performance review arrives, a quantified assessment of your month's performance. Numbers and metrics try to capture your value, but you know what's truly important often can't be measured. This review is like using a ruler to measure poetry's beauty—the tool is precise, but the object is wrong. You begin thinking: in this data-driven era, has human value also been reduced to a few cold numbers?"
207,"周末到了，你感受到一种难得的解脱感。这两天的自由时间就像是监狱里的假释——虽然短暂，但足以让你记起自己还是一个人，而不仅仅是一个工作机器。你的身体开始放松，心情也变得轻松起来。但你也知道，这种自由只是暂时的，周一的钟声很快就会再次响起。","Weekend arrives, and you feel a rare sense of relief. These two days of free time are like parole from prison—though brief, enough to remind you that you're still a person, not just a work machine. Your body begins to relax, your mood lightens. But you also know this freedom is temporary; Monday's bell will soon ring again."
208,"每日的生活开销又从你的账户中扣除了一笔钱。这些看似微不足道的小额支出，累积起来却是一个惊人的数字。你开始计算，为了维持这种基本的生活水平，你需要工作多少小时。这种计算让你意识到，生活本身已经被货币化了——每一口呼吸都有价格，每一个微笑都需要成本。","Daily living expenses deduct another sum from your account. These seemingly insignificant small expenditures accumulate to an astonishing figure. You begin calculating how many hours you need to work to maintain this basic living standard. This calculation makes you realize life itself has been monetized—every breath has a price, every smile requires cost."
209,"健康检查的提醒出现在你的日程中，这是对身体状况的一次审视。在这个快节奏的生活中，我们往往忽视了身体发出的警告信号，直到它们变成无法忽视的问题。这种提醒就像是身体的求救信号，提醒你在追求事业成功的同时，不要忘记照顾这个承载一切的载体。","A health check reminder appears in your schedule, an examination of your physical condition. In this fast-paced life, we often ignore warning signals from our bodies until they become impossible to ignore. This reminder is like a distress signal from your body, reminding you not to forget caring for this vessel that carries everything while pursuing career success."
210,"技能衰退的警告悄然出现，这是对停滞不前的惩罚。在这个快速变化的行业中，不进步就意味着退步。你的技能就像是需要不断维护的机器，一旦停止学习，就会开始生锈。这种衰退不仅仅是能力的下降，更是对未来不确定性的增加。你开始意识到，在这个时代，学习不是选择，而是生存的必需品。","A skill deterioration warning quietly appears, punishment for stagnation. In this rapidly changing industry, not progressing means regressing. Your skills are like machines requiring constant maintenance; once you stop learning, they begin to rust. This deterioration isn't just declining ability, but increasing future uncertainty. You begin realizing that in this era, learning isn't a choice, but a survival necessity."
211,"社交需求的警告提醒你，人类是社会性动物，长期的孤立会对心理健康造成损害。在这个数字化的时代，我们有了更多的连接方式，但真正的连接却变得更加稀少。你开始思考，什么是真正的社交？是微信群里的点赞，还是面对面的深度交流？这种需求的出现提醒你，技术无法完全替代人与人之间的真实接触。","A social needs warning reminds you that humans are social animals; prolonged isolation damages mental health. In this digital era, we have more ways to connect, but true connection has become rarer. You begin thinking: what is real socializing? Likes in WeChat groups, or face-to-face deep communication? This need's emergence reminds you that technology cannot completely replace genuine human contact."
212,"空气净化器静静地工作着，试图改善你居住环境的空气质量。这台机器就像是现代生活的隐喻——我们用科技来解决科技带来的问题，用人工的方式来修复人工环境的缺陷。每一次净化都在提醒你，我们已经生活在一个需要不断修复的世界中。这种修复不仅仅是对环境的，更是对我们生活方式的反思。","The air purifier works quietly, trying to improve the air quality of your living environment. This machine is like a metaphor for modern life—we use technology to solve problems brought by technology, use artificial methods to repair artificial environment's flaws. Each purification reminds you that we're living in a world requiring constant repair. This repair isn't just environmental, but reflection on our lifestyle." 